<?identification version="1.0" encoding="UTF-8"?>
<universityCard xmlns:xsi="http://www.w3.org/2001/XMLSchema-instance"
                    xsi:noNamespaceSchemaLocation="universityCard.xsd">
        <university>UNIVERSIDAD NACIONAL MAYOR DE SAN MARCOS</university>
        <code>15200134</code>
        <dni>76517361</dni>
        <lastName>CUADROS RAMOS</lastName>
        <firstName>KENT JHUNIOR</firstName>
        <faculty>INGENIERÍA DE SISTEMAS E INFORMÁTICA</faculty>
        <career>INGENIERIA DE SOFTWARE</career>
        <year>2021</year>
        <incomeYear>2021-2</incomeYear>
        <expirationDate>23-12-2022</expirationDate>
</universityCard>