<?identification version="1.0" encoding="UTF-8"?>
<universityCard xmlns:xsi="http://www.w3.org/2001/XMLSchema-instance" xsi:noNamespaceSchemaLocation="universityCard.xsd">
    <university>UNIVERSIDAD NACIONAL MAYOR DE SAN MARCOS</university>
    <code>17200133</code>
    <dni>76517368</dni>
    <lastName>ARMAS ABT</lastName>
    <firstName>MIGUEL RODRIGO</firstName>
    <faculty>INGENIERÍA DE SISTEMAS E INFORMÁTICA</faculty>
    <career>INGENIERÍA DE SISTEMAS</career>
    <year>2021</year>
    <semester>2021-2</semester>
    <expirationDate>23-12-2022</expirationDate>
</universityCard>